ProductID,Category,Sub-Category,ProductName,ProductID_Key
FUR-TA-10000577,Furniture,Tables,Bretford CR4500 Series Slim Rectangular Table,1
OFF-ST-10000760,Office Supplies,Storage,Eldon Fold 'N Roll Cart System,2
OFF-AP-10002311,Office Supplies,Appliances,"Holmes Replacement Filter for HEPA Air Cleaner, Very Large Room, HEPA Filter",3
OFF-BI-10000756,Office Supplies,Binders,Storex DuraTech Recycled Plastic Frosted Binders,4
FUR-CH-10002774,Furniture,Chairs,"Global Deluxe Stacking Chair, Gray",5
FUR-BO-10004834,Furniture,Bookcases,"Riverside Palais Royal Lawyers Bookcase, Royale Cherry Finish",6
OFF-BI-10000474,Office Supplies,Binders,Avery Recycled Flexi-View Covers for Binding Systems,7
FUR-FU-10004848,Furniture,Furnishings,"Howard Miller 13-3/4"" Diameter Brushed Chrome Round Wall Clock",8
OFF-EN-10001509,Office Supplies,Envelopes,Poly String Tie Envelopes,9
OFF-AR-10004042,Office Supplies,Art,"BOSTON Model 1800 Electric Pencil Sharpeners, Putty/Woodgrain",10
OFF-BI-10001525,Office Supplies,Binders,"Acco Pressboard Covers with Storage Hooks, 14 7/8"" x 11"", Executive Red",11
OFF-AR-10001683,Office Supplies,Art,Lumber Crayons,12
FUR-CH-10001146,Furniture,Chairs,"Global Value Mid-Back Manager's Chair, Gray",13
FUR-CH-10000513,Furniture,Chairs,High-Back Leather Manager's Chair,14
FUR-FU-10003708,Furniture,Furnishings,"Tenex Traditional Chairmats for Medium Pile Carpet, Standard Lip, 36"" x 48""",15
OFF-ST-10004123,Office Supplies,Storage,Safco Industrial Wire Shelving System,16
OFF-BI-10004182,Office Supplies,Binders,Economy Binders,17
FUR-FU-10000260,Furniture,Furnishings,"6"" Cubicle Wall Clock, Black",18
OFF-ST-10000615,Office Supplies,Storage,"SimpliFile Personal File, Black Granite, 15w x 6-15/16d x 11-1/4h",19
FUR-FU-10003194,Furniture,Furnishings,"Eldon Expressions Desk Accessory, Wood Pencil Holder, Oak",20
OFF-ST-10003656,Office Supplies,Storage,Safco Industrial Wire Shelving,21
OFF-BI-10004738,Office Supplies,Binders,Flexible Leather- Look Classic Collection Ring Binder,22
TEC-AC-10001552,Technology,Accessories,Logitech K350 2.4Ghz Wireless Keyboard,23
FUR-FU-10004006,Furniture,Furnishings,"Deflect-o DuraMat Lighweight, Studded, Beveled Mat for Low Pile Carpeting",24
OFF-BI-10002794,Office Supplies,Binders,"Avery Trapezoid Ring Binder, 3"" Capacity, Black, 1040 sheets",25
OFF-BI-10003650,Office Supplies,Binders,GBC DocuBind 300 Electric Binding Machine,26
FUR-CH-10004063,Furniture,Chairs,Global Deluxe High-Back Manager's Chair,27
FUR-TA-10004534,Furniture,Tables,Bevis 44 x 96 Conference Tables,28
OFF-BI-10003274,Office Supplies,Binders,"Avery Durable Slant Ring Binders, No Labels",29
OFF-ST-10002974,Office Supplies,Storage,"Trav-L-File Heavy-Duty Shuttle II, Black",30
FUR-CH-10001146,Furniture,Chairs,"Global Task Chair, Black",31
FUR-FU-10003773,Furniture,Furnishings,Eldon Cleatmat Plus Chair Mats for High Pile Carpets,32
TEC-PH-10002293,Technology,Phones,Anker 36W 4-Port USB Wall Charger Travel Power Adapter for iPhone 5s 5c 5,33
OFF-PA-10002377,Office Supplies,Paper,Xerox 1916,34
OFF-FA-10002780,Office Supplies,Fasteners,Staples,35
OFF-AP-10000891,Office Supplies,Appliances,Kensington 7 Outlet MasterPiece HOMEOFFICE Power Control Center,36
OFF-LA-10003148,Office Supplies,Labels,Avery 51,37
OFF-AP-10002684,Office Supplies,Appliances,"Acco 7-Outlet Masterpiece Power Center, Wihtout Fax/Phone Line Protection",38
FUR-CH-10004698,Furniture,Chairs,"Padded Folding Chairs, Black, 4/Carton",39
OFF-SU-10002189,Office Supplies,Supplies,Acme Rosewood Handle Letter Opener,40
OFF-BI-10000343,Office Supplies,Binders,"Pressboard Covers with Storage Hooks, 9 1/2"" x 11"", Light Blue",41
OFF-PA-10002749,Office Supplies,Paper,"Wirebound Message Books, 5-1/2 x 4 Forms, 2 or 4 Forms per Page",42
OFF-AP-10003217,Office Supplies,Appliances,Eureka Sanitaire  Commercial Upright,43
FUR-CH-10004860,Furniture,Chairs,Global Low Back Tilter Chair,44
FUR-CH-10004477,Furniture,Chairs,"Global Push Button Manager's Chair, Indigo",45
OFF-BI-10001679,Office Supplies,Binders,GBC Instant Index System for Binding Systems,46
FUR-TA-10001705,Furniture,Tables,Bush Advantage Collection Round Conference Table,47
FUR-TA-10003473,Furniture,Tables,Bretford Rectangular Conference Table Tops,48
FUR-FU-10004017,Furniture,Furnishings,"Tenex Contemporary Contur Chairmats for Low and Medium Pile Carpet, Computer, 39"" x 49""",49
TEC-AC-10003832,Technology,Accessories,Logitech P710e Mobile Speakerphone,50
FUR-FU-10002505,Furniture,Furnishings,Eldon 100 Class Desk Accessories,51
OFF-ST-10004804,Office Supplies,Storage,"Belkin 19"" Vented Equipment Shelf, Black",52
OFF-ST-10001590,Office Supplies,Storage,"Tenex Personal Project File with Scoop Front Design, Black",53
TEC-PH-10001580,Technology,Phones,Logitech Mobile Speakerphone P710e - speaker phone,54
OFF-AP-10002203,Office Supplies,Appliances,Eureka Disposable Bags for Sanitaire Vibra Groomer I Upright Vac,55
TEC-MA-10000822,Technology,Machines,Lexmark MX611dhe Monochrome Laser Printer,56
TEC-MA-10003353,Technology,Machines,Xerox WorkCentre 6505DN Laser Multifunction Printer,57
OFF-ST-10004180,Office Supplies,Storage,Safco Commercial Shelving,58
OFF-EN-10004386,Office Supplies,Envelopes,"Recycled Interoffice Envelopes with String and Button Closure, 10 x 13",59
OFF-BI-10004967,Office Supplies,Binders,Round Ring Binders,60
TEC-PH-10001760,Technology,Phones,Bose SoundLink Bluetooth Speaker,61
FUR-TA-10002533,Furniture,Tables,BPI Conference Tables,62
TEC-PH-10003645,Technology,Phones,Aastra 57i VoIP phone,63
OFF-ST-10000675,Office Supplies,Storage,"File Shuttle II and Handi-File, Black",64
FUR-CH-10003312,Furniture,Chairs,Hon 2090 Pillow Soft Series Mid Back Swivel/Tilt Chairs,65
OFF-LA-10001074,Office Supplies,Labels,Round Specialty Laser Printer Labels,66
OFF-BI-10001524,Office Supplies,Binders,GBC Premium Transparent Covers with Diagonal Lined Pattern,67
TEC-PH-10004614,Technology,Phones,AT&T 841000 Phone,68
OFF-BI-10001153,Office Supplies,Binders,Ibico Recycled Grain-Textured Covers,69
OFF-BI-10001982,Office Supplies,Binders,Wilson Jones Custom Binder Spines & Labels,70
OFF-ST-10000107,Office Supplies,Storage,Fellowes Super Stor/Drawer,71
TEC-AC-10003911,Technology,Accessories,NETGEAR AC1750 Dual Band Gigabit Smart WiFi Router,72
OFF-AR-10000658,Office Supplies,Art,Newell 324,73
TEC-AC-10002076,Technology,Accessories,Microsoft Natural Keyboard Elite,74
OFF-PA-10003039,Office Supplies,Paper,Xerox 1960,75
FUR-TA-10004915,Furniture,Tables,"Office Impressions End Table, 20-1/2""H x 24""W x 20""D",76
FUR-TA-10000617,Furniture,Tables,"Hon Practical Foundations 30 x 60 Training Table, Light Gray/Charcoal",77
TEC-AC-10002335,Technology,Accessories,Logitech Media Keyboard K200,78
TEC-PH-10003012,Technology,Phones,Nortel Meridian M3904 Professional Digital phone,79
TEC-CO-10002313,Technology,Copiers,Canon PC1080F Personal Copier,80
OFF-BI-10003982,Office Supplies,Binders,Wilson Jones Century Plastic Molded Ring Binders,81
OFF-BI-10004584,Office Supplies,Binders,GBC ProClick 150 Presentation Binding System,82
TEC-AC-10004659,Technology,Accessories,Imation Secure+ Hardware Encrypted USB 2.0 Flash Drive; 16GB,83
OFF-ST-10000617,Office Supplies,Storage,Woodgrain Magazine Files by Perma,84
OFF-BI-10000773,Office Supplies,Binders,Insertable Tab Post Binder Dividers,85
TEC-AC-10002600,Technology,Accessories,Belkin QODE FastFit Bluetooth Keyboard,86
FUR-CH-10000225,Furniture,Chairs,"Global Geo Office Task Chair, Gray",87
FUR-CH-10002331,Furniture,Chairs,Hon 4700 Series Mobuis Mid-Back Task Chairs with Adjustable Arms,88
OFF-EN-10001415,Office Supplies,Envelopes,Staple envelope,89
FUR-FU-10002918,Furniture,Furnishings,Eldon ClusterMat Chair Mat with Cordless Antistatic Protection,90
OFF-BI-10002194,Office Supplies,Binders,Cardinal Hold-It CD Pocket,91
FUR-TA-10001857,Furniture,Tables,Balt Solid Wood Rectangular Table,92
OFF-BI-10001670,Office Supplies,Binders,Vinyl Sectional Post Binders,93
OFF-BI-10001658,Office Supplies,Binders,GBC Standard Therm-A-Bind Covers,94
FUR-CH-10001215,Furniture,Chairs,Global Troy Executive Leather Low-Back Tilter,95
OFF-BI-10000831,Office Supplies,Binders,Storex Flexible Poly Binders with Double Pockets,96
OFF-PA-10000357,Office Supplies,Paper,"White Dual Perf Computer Printout Paper, 2700 Sheets, 1 Part, Heavyweight, 20 lbs., 14 7/8 x 11",97
TEC-PH-10003555,Technology,Phones,Motorola HK250 Universal Bluetooth Headset,98
TEC-AC-10003832,Technology,Accessories,Imation 16GB Mini TravelDrive USB 2.0 Flash Drive,99
OFF-ST-10004963,Office Supplies,Storage,Eldon Gobal File Keepers,100
OFF-SU-10002881,Office Supplies,Supplies,Martin Yale Chadless Opener Electric Letter Opener,101
OFF-EN-10001335,Office Supplies,Envelopes,"White Business Envelopes with Contemporary Seam, Recycled White Business Envelopes",102
FUR-FU-10000448,Furniture,Furnishings,Tenex Chairmats For Use With Carpeted Floors,103
OFF-BI-10002429,Office Supplies,Binders,"Premier Elliptical Ring Binder, Black",104
OFF-ST-10001809,Office Supplies,Storage,Fellowes Officeware Wire Shelving,105
TEC-PH-10003800,Technology,Phones,i.Sound Portable Power - 8000 mAh,106
OFF-PA-10002005,Office Supplies,Paper,Xerox 225,107
OFF-BI-10002498,Office Supplies,Binders,Clear Mylar Reinforcing Strips,108
OFF-PA-10004101,Office Supplies,Paper,Xerox 1894,109
TEC-PH-10001425,Technology,Phones,Mophie Juice Pack Helium for iPhone,110
TEC-PH-10003963,Technology,Phones,GE 2-Jack Phone Line Splitter,111
OFF-SU-10001574,Office Supplies,Supplies,Acme Value Line Scissors,112
OFF-BI-10000848,Office Supplies,Binders,Angle-D Ring Binders,113
OFF-AR-10001246,Office Supplies,Art,Newell 317,114
TEC-PH-10003092,Technology,Phones,Motorola L804,115
OFF-BI-10002103,Office Supplies,Binders,"Cardinal Slant-D Ring Binder, Heavy Gauge Vinyl",116
OFF-ST-10001963,Office Supplies,Storage,Tennsco Regal Shelving Units,117
TEC-AC-10001267,Technology,Accessories,Imation 32GB Pocket Pro USB 3.0 Flash Drive - 32 GB - Black - 1 P ...,118
TEC-PH-10002103,Technology,Phones,Jabra SPEAK 410,119
OFF-BI-10001989,Office Supplies,Binders,Premium Transparent Presentation Covers by GBC,120
OFF-AP-10003287,Office Supplies,Appliances,Tripp Lite TLP810NET Broadband Surge for Modem/Fax,121
OFF-PA-10001934,Office Supplies,Paper,Xerox 1993,122
OFF-BI-10004654,Office Supplies,Binders,Avery Binding System Hidden Tab Executive Style Index Sets,123
FUR-FU-10002759,Furniture,Furnishings,12-1/2 Diameter Round Wall Clock,124
FUR-TA-10000688,Furniture,Tables,"Chromcraft Bull-Nose Wood Round Conference Table Top, Wood Base",125
OFF-PA-10002377,Office Supplies,Paper,"Adams Telephone Message Book W/Dividers/Space For Phone Numbers, 5 1/4""X8 1/2"", 200/Messages",126
OFF-AP-10000804,Office Supplies,Appliances,Hoover Portapower Portable Vacuum,127
TEC-AC-10003614,Technology,Accessories,"Verbatim 25 GB 6x Blu-ray Single Layer Recordable Disc, 10/Pack",128
FUR-FU-10003553,Furniture,Furnishings,"Howard Miller 13-1/2"" Diameter Rosebrook Wall Clock",129
OFF-BI-10004632,Office Supplies,Binders,Ibico Hi-Tech Manual Binding System,130
TEC-MA-10004125,Technology,Machines,Cubify CubeX 3D Printer Triple Head Print,131
OFF-AP-10002457,Office Supplies,Appliances,"Eureka The Boss Plus 12-Amp Hard Box Upright Vacuum, Red",132
FUR-FU-10004071,Furniture,Furnishings,Luxo Professional Magnifying Clamp-On Fluorescent Lamps,133
TEC-PH-10002033,Technology,Phones,Konftel 250 Conference phone - Charcoal black,134
OFF-ST-10002444,Office Supplies,Storage,Recycled Eldon Regeneration Jumbo File,135
OFF-AP-10001154,Office Supplies,Appliances,Bionaire Personal Warm Mist Humidifier/Vaporizer,136
TEC-AC-10001606,Technology,Accessories,Logitech Wireless Performance Mouse MX for PC and Mac,137
OFF-PA-10001954,Office Supplies,Paper,Xerox 1964,138
FUR-TA-10002228,Furniture,Tables,"Bevis Traditional Conference Table Top, Plinth Base",139
OFF-ST-10004634,Office Supplies,Storage,"Personal Folder Holder, Ebony",140
FUR-CH-10002965,Furniture,Chairs,"Global Leather Highback Executive Chair with Pneumatic Height Adjustment, Black",141
OFF-LA-10001317,Office Supplies,Labels,Avery 520,142
OFF-SU-10004498,Office Supplies,Supplies,Martin-Yale Premier Letter Opener,143
OFF-PA-10002615,Office Supplies,Paper,"Ampad Gold Fibre Wirebound Steno Books, 6"" x 9"", Gregg Ruled",144
OFF-PA-10004971,Office Supplies,Paper,Xerox 196,145
OFF-SU-10004261,Office Supplies,Supplies,"Fiskars 8"" Scissors, 2/Pack",146
OFF-BI-10001098,Office Supplies,Binders,Acco D-Ring Binder w/DublLock,147
TEC-AC-10002167,Technology,Accessories,Imation 8gb Micro Traveldrive Usb 2.0 Flash Drive,148
FUR-BO-10004409,Furniture,Bookcases,"Safco Value Mate Series Steel Bookcases, Baked Enamel Finish on Steel, Gray",149
TEC-AC-10000057,Technology,Accessories,Microsoft Natural Ergonomic Keyboard 4000,150
TEC-AC-10003441,Technology,Accessories,Kingston Digital DataTraveler 32GB USB 2.0,151
TEC-AC-10000109,Technology,Accessories,Sony Micro Vault Click 16 GB USB 2.0 Flash Drive,152
OFF-BI-10001071,Office Supplies,Binders,GBC ProClick Punch Binding System,153
OFF-PA-10001560,Office Supplies,Paper,"Adams Telephone Message Books, 5 1/4 x 11",154
TEC-PH-10002365,Technology,Phones,Belkin Grip Candy Sheer Case / Cover for iPhone 5 and 5S,155
OFF-BI-10003712,Office Supplies,Binders,"Acco Pressboard Covers with Storage Hooks, 14 7/8"" x 11"", Light Blue",156
OFF-AR-10001118,Office Supplies,Art,"Binney & Smith Crayola Metallic Crayons, 16-Color Pack",157
OFF-BI-10004716,Office Supplies,Binders,Wilson Jones Hanging Recycled Pressboard Data Binders,158
FUR-TA-10001520,Furniture,Tables,"Lesro Sheffield Collection Coffee Table, End Table, Center Table, Corner Table",159
FUR-CH-10003379,Furniture,Chairs,Global Commerce Series High-Back Swivel/Tilt Chairs,160
OFF-BI-10002706,Office Supplies,Binders,Avery Premier Heavy-Duty Binder with Round Locking Rings,161
FUR-TA-10002356,Furniture,Tables,Bevis Boat-Shaped Conference Table,162
FUR-FU-10003601,Furniture,Furnishings,"Deflect-o RollaMat Studded, Beveled Mat for Medium Pile Carpeting",163
FUR-FU-10000576,Furniture,Furnishings,Luxo Professional Fluorescent Magnifier Lamp with Clamp-Mount Base,164
FUR-TA-10004154,Furniture,Tables,"Riverside Furniture Oval Coffee Table, Oval End Table, End Table with Drawer",165
OFF-PA-10000788,Office Supplies,Paper,Xerox 210,166
OFF-PA-10002479,Office Supplies,Paper,Xerox 4200 Series MultiUse Premium Copy Paper (20Lb. and 84 Bright),167
OFF-BI-10004492,Office Supplies,Binders,Tuf-Vin Binders,168
OFF-BI-10002012,Office Supplies,Binders,Wilson Jones Easy Flow II Sheet Lifters,169
OFF-PA-10001509,Office Supplies,Paper,"Recycled Desk Saver Line ""While You Were Out"" Book, 5 1/2"" X 4""",170
FUR-TA-10003748,Furniture,Tables,Bevis 36 x 72 Conference Tables,171
TEC-AC-10003198,Technology,Accessories,Enermax Acrylux Wireless Keyboard,172
FUR-FU-10000293,Furniture,Furnishings,Eldon Antistatic Chair Mats for Low to Medium Pile Carpets,173
OFF-PA-10001307,Office Supplies,Paper,"Important Message Pads, 50 4-1/4 x 5-1/2 Forms per Pad",174
FUR-FU-10004460,Furniture,Furnishings,"Howard Miller 12"" Round Wall Clock",175
FUR-CH-10003396,Furniture,Chairs,Global Deluxe Steno Chair,176
OFF-SU-10001935,Office Supplies,Supplies,Staple remover,177
FUR-TA-10001095,Furniture,Tables,Chromcraft Round Conference Tables,178
OFF-PA-10003127,Office Supplies,Paper,Easy-staple paper,179
OFF-ST-10003208,Office Supplies,Storage,Adjustable Depth Letter/Legal Cart,180
TEC-MA-10003979,Technology,Machines,Ativa V4110MDD Micro-Cut Shredder,181
OFF-BI-10004140,Office Supplies,Binders,Avery Non-Stick Binders,182
OFF-BI-10002049,Office Supplies,Binders,UniKeep View Case Binders,183
OFF-ST-10000642,Office Supplies,Storage,"Tennsco Lockers, Gray",184
FUR-FU-10000206,Furniture,Furnishings,"GE General Purpose, Extra Long Life, Showcase & Floodlight Incandescent Bulbs",185
OFF-BI-10003676,Office Supplies,Binders,"GBC Standard Recycled Report Covers, Clear Plastic Sheets",186
OFF-FA-10003495,Office Supplies,Fasteners,Staples,187
OFF-EN-10003798,Office Supplies,Envelopes,"Recycled Interoffice Envelopes with Re-Use-A-Seal Closure, 10 x 13",188
TEC-PH-10003589,Technology,Phones,invisibleSHIELD by ZAGG Smudge-Free Screen Protector,189
OFF-PA-10004735,Office Supplies,Paper,Xerox 1905,190
OFF-BI-10002609,Office Supplies,Binders,Avery Hidden Tab Dividers for Binding Systems,191
TEC-PH-10001061,Technology,Phones,Apple iPhone 5C,192
OFF-AR-10002375,Office Supplies,Art,Newell 351,193
OFF-AR-10003811,Office Supplies,Art,Newell 327,194
OFF-EN-10001539,Office Supplies,Envelopes,Staple envelope,195
OFF-PA-10004100,Office Supplies,Paper,Xerox 216,196
OFF-ST-10003479,Office Supplies,Storage,"Eldon Base for stackable storage shelf, platinum",197
OFF-LA-10000973,Office Supplies,Labels,Avery 502,198
OFF-ST-10001476,Office Supplies,Storage,Steel Personal Filing/Posting Tote,199
OFF-PA-10002259,Office Supplies,Paper,"Geographics Note Cards, Blank, White, 8 1/2"" x 11""",200
OFF-BI-10000301,Office Supplies,Binders,GBC Instant Report Kit,201
OFF-PA-10001937,Office Supplies,Paper,Xerox 21,202
FUR-FU-10002268,Furniture,Furnishings,Ultra Door Push Plate,203
OFF-ST-10001321,Office Supplies,Storage,"Decoflex Hanging Personal Folder File, Blue",204
FUR-FU-10003394,Furniture,Furnishings,"Tenex ""The Solids"" Textured Chair Mats",205
OFF-BI-10002432,Office Supplies,Binders,Wilson Jones Standard D-Ring Binders,206
OFF-BI-10000069,Office Supplies,Binders,"GBC Prepunched Paper, 19-Hole, for Binding Systems, 24-lb",207
OFF-AR-10003602,Office Supplies,Art,"Quartet Omega Colored Chalk, 12/Pack",208
TEC-AC-10004469,Technology,Accessories,Microsoft Sculpt Comfort Mouse,209
FUR-FU-10001867,Furniture,Furnishings,"Eldon Expressions Punched Metal & Wood Desk Accessories, Pewter & Cherry",210
TEC-AC-10003174,Technology,Accessories,Plantronics S12 Corded Telephone Headset System,211
TEC-PH-10002200,Technology,Phones,Samsung Galaxy Note 2,212
OFF-BI-10004519,Office Supplies,Binders,GBC DocuBind P100 Manual Binding Machine,213
OFF-FA-10000304,Office Supplies,Fasteners,Advantus Push Pins,214
OFF-BI-10001575,Office Supplies,Binders,GBC Linen Binding Covers,215
OFF-ST-10003716,Office Supplies,Storage,Tennsco Double-Tier Lockers,216
OFF-BI-10004236,Office Supplies,Binders,"XtraLife ClearVue Slant-D Ring Binder, White, 3""",217
OFF-ST-10003306,Office Supplies,Storage,Letter Size Cart,218
OFF-ST-10000563,Office Supplies,Storage,Fellowes Bankers Box Stor/Drawer Steel Plus,219
OFF-AP-10004487,Office Supplies,Appliances,Kensington 4 Outlet MasterPiece Compact Power Control Center,220
OFF-BI-10002854,Office Supplies,Binders,"Performers Binder/Pad Holder, Black",221
OFF-BI-10002813,Office Supplies,Binders,Avery Reinforcements for Hole-Punch Pages,222
FUR-FU-10002554,Furniture,Furnishings,"Westinghouse Floor Lamp with Metal Mesh Shade, Black",223
TEC-PH-10001557,Technology,Phones,Pyle PMP37LED,224
FUR-CH-10003199,Furniture,Chairs,Office Star - Contemporary Task Swivel Chair,225
OFF-BI-10004139,Office Supplies,Binders,Fellowes Presentation Covers for Comb Binding Machines,226
FUR-FU-10003724,Furniture,Furnishings,Westinghouse Clip-On Gooseneck Lamps,227
OFF-ST-10001522,Office Supplies,Storage,"Gould Plastics 18-Pocket Panel Bin, 34w x 5-1/4d x 20-1/2h",228
FUR-CH-10002961,Furniture,Chairs,"Leather Task Chair, Black",229
OFF-BI-10001036,Office Supplies,Binders,Cardinal EasyOpen D-Ring Binders,230
TEC-MA-10003183,Technology,Machines,DYMO CardScan Personal V9 Business Card Scanner,231
TEC-AC-10001314,Technology,Accessories,Case Logic 2.4GHz Wireless Keyboard,232
TEC-PH-10002563,Technology,Phones,Adtran 1202752G1,233
FUR-BO-10002613,Furniture,Bookcases,"Atlantic Metals Mobile 4-Shelf Bookcases, Custom Colors",234
OFF-AR-10003405,Office Supplies,Art,"Dixon My First Ticonderoga Pencil, #2",235
OFF-LA-10002312,Office Supplies,Labels,Avery 490,236
OFF-BI-10000042,Office Supplies,Binders,"Pressboard Data Binder, Crimson, 12"" X 8 1/2""",237
OFF-ST-10002344,Office Supplies,Storage,"Carina 42""Hx23 3/4""W Media Storage Unit",238
OFF-PA-10001289,Office Supplies,Paper,White Computer Printout Paper by Universal,239
OFF-FA-10000053,Office Supplies,Fasteners,Revere Boxed Rubber Bands by Revere,240
FUR-FU-10004091,Furniture,Furnishings,"Eldon 200 Class Desk Accessories, Black",241
FUR-BO-10004015,Furniture,Bookcases,"Bush Andora Bookcase, Maple/Graphite Gray Finish",242
OFF-EN-10003001,Office Supplies,Envelopes,Ames Color-File Green Diamond Border X-ray Mailers,243
TEC-PH-10000215,Technology,Phones,Plantronics Cordless Phone Headset with In-line Volume - M214C,244
OFF-PA-10003892,Office Supplies,Paper,Xerox 1943,245
FUR-TA-10002958,Furniture,Tables,"Bevis Oval Conference Table, Walnut",246
FUR-TA-10001676,Furniture,Tables,Hon 61000 Series Interactive Training Tables,247
FUR-TA-10002622,Furniture,Tables,"Bush Andora Conference Table, Maple/Graphite Gray Finish",248
OFF-PA-10000418,Office Supplies,Paper,Xerox 189,249
FUR-TA-10001039,Furniture,Tables,KI Adjustable-Height Table,250
OFF-BI-10002949,Office Supplies,Binders,Prestige Round Ring Binders,251
OFF-EN-10002600,Office Supplies,Envelopes,"Redi-Strip #10 Envelopes, 4 1/8 x 9 1/2",252
OFF-BI-10003708,Office Supplies,Binders,"Acco Four Pocket Poly Ring Binder with Label Holder, Smoke, 1""",253
OFF-LA-10003510,Office Supplies,Labels,"Avery 4027 File Folder Labels for Dot Matrix Printers, 5000 Labels per Box, White",254
OFF-PA-10003673,Office Supplies,Paper,Strathmore Photo Mount Cards,255
OFF-BI-10004876,Office Supplies,Binders,Wilson Jones Suede Grain Vinyl Binders,256
OFF-BI-10004352,Office Supplies,Binders,Wilson Jones DublLock D-Ring Binders,257
OFF-FA-10001754,Office Supplies,Fasteners,Stockwell Gold Paper Clips,258
OFF-AR-10000634,Office Supplies,Art,Newell 320,259
FUR-FU-10004270,Furniture,Furnishings,"Eldon Image Series Desk Accessories, Burgundy",260
OFF-LA-10003121,Office Supplies,Labels,Avery 506,261
OFF-PA-10002262,Office Supplies,Paper,Xerox 192,262
OFF-PA-10002464,Office Supplies,Paper,HP Office Recycled Paper (20Lb. and 87 Bright),263
OFF-ST-10002214,Office Supplies,Storage,X-Rack File for Hanging Folders,264
TEC-AC-10000865,Technology,Accessories,WD My Passport Ultra 500GB Portable External Hard Drive,265
OFF-AP-10004868,Office Supplies,Appliances,Hoover Commercial Soft Guard Upright Vacuum And Disposable Filtration Bags,266
FUR-CH-10000863,Furniture,Chairs,Novimex Swivel Fabric Task Chair,267
OFF-EN-10003160,Office Supplies,Envelopes,Pastel Pink Envelopes,268
TEC-AC-10003280,Technology,Accessories,Belkin F8E887 USB Wired Ergonomic Keyboard,269
FUR-CH-10000595,Furniture,Chairs,Safco Contoured Stacking Chairs,270
OFF-AR-10001221,Office Supplies,Art,"Dixon Ticonderoga Erasable Colored Pencil Set, 12-Color",271
OFF-FA-10002988,Office Supplies,Fasteners,Ideal Clamps,272
OFF-AR-10003251,Office Supplies,Art,Prang Drawing Pencil Set,273
TEC-PH-10004700,Technology,Phones,PowerGen Dual USB Car Charger,274
OFF-AR-10000823,Office Supplies,Art,Newell 307,275
OFF-AR-10004456,Office Supplies,Art,Panasonic KP-4ABK Battery-Operated Pencil Sharpener,276
OFF-BI-10000050,Office Supplies,Binders,"Angle-D Binders with Locking Rings, Label Holders",277
OFF-BI-10000591,Office Supplies,Binders,Avery Binder Labels,278
TEC-AC-10004855,Technology,Accessories,V7 USB Numeric Keypad,279
OFF-ST-10000352,Office Supplies,Storage,Acco Perma 2700 Stacking Storage Drawers,280
OFF-PA-10000575,Office Supplies,Paper,"Wirebound Message Books, Four 2 3/4 x 5 White Forms per Page",281
OFF-FA-10003112,Office Supplies,Fasteners,Staples,282
OFF-ST-10003442,Office Supplies,Storage,Eldon Portable Mobile Manager,283
OFF-FA-10000611,Office Supplies,Fasteners,Binder Clips by OIC,284
OFF-BI-10001116,Office Supplies,Binders,"Wilson Jones 1"" Hanging DublLock Ring Binders",285
FUR-TA-10001889,Furniture,Tables,Bush Advantage Collection Racetrack Conference Table,286
OFF-PA-10000176,Office Supplies,Paper,Xerox 1887,287
FUR-FU-10004020,Furniture,Furnishings,Advantus Panel Wall Acrylic Frame,288
TEC-AC-10003133,Technology,Accessories,Memorex Mini Travel Drive 4 GB USB 2.0 Flash Drive,289
FUR-TA-10004289,Furniture,Tables,BoxOffice By Design Rectangular and Half-Moon Meeting Room Tables,290
TEC-AC-10000736,Technology,Accessories,Logitech G600 MMO Gaming Mouse,291
FUR-BO-10003966,Furniture,Bookcases,"Sauder Facets Collection Library, Sky Alder Finish",292
FUR-TA-10001307,Furniture,Tables,"SAFCO PlanMaster Heigh-Adjustable Drafting Table Base, 43w x 30d x 30-37h, Black",293
OFF-ST-10000689,Office Supplies,Storage,"Fellowes Strictly Business Drawer File, Letter/Legal Size",294
OFF-AR-10002135,Office Supplies,Art,Boston Heavy-Duty Trimline Electric Pencil Sharpeners,295
OFF-PA-10003543,Office Supplies,Paper,Xerox 1985,296
OFF-AR-10002221,Office Supplies,Art,12 Colored Short Pencils,297
OFF-BI-10001765,Office Supplies,Binders,Wilson Jones Heavy-Duty Casebound Ring Binders with Metal Hinges,298
OFF-BI-10004410,Office Supplies,Binders,"C-Line Peel & Stick Add-On Filing Pockets, 8-3/4 x 5-1/8, 10/Pack",299
OFF-BI-10002735,Office Supplies,Binders,GBC Prestige Therm-A-Bind Covers,300
OFF-ST-10002352,Office Supplies,Storage,Iris Project Case,301
TEC-PH-10000455,Technology,Phones,GE 30522EE2,302
OFF-BI-10003910,Office Supplies,Binders,DXL Angle-View Binders with Locking Rings by Samsill,303
TEC-AC-10001465,Technology,Accessories,SanDisk Cruzer 64 GB USB Flash Drive,304
FUR-FU-10001861,Furniture,Furnishings,"Floodlight Indoor Halogen Bulbs, 1 Bulb per Pack, 60 Watts",305
OFF-AP-10001394,Office Supplies,Appliances,Harmony Air Purifier,306
FUR-FU-10002553,Furniture,Furnishings,"Electrix Incandescent Magnifying Lamp, Black",307
OFF-PA-10000019,Office Supplies,Paper,Xerox 1931,308
TEC-AC-10003027,Technology,Accessories,Imation 8GB Mini TravelDrive USB 2.0 Flash Drive,309
OFF-PA-10001804,Office Supplies,Paper,Xerox 195,310
FUR-FU-10004973,Furniture,Furnishings,Flat Face Poster Frame,311
OFF-BI-10002133,Office Supplies,Binders,"Wilson Jones Elliptical Ring 3 1/2"" Capacity Binders, 800 sheets",312
